id;category;subtopic;question;question_type;expected_answer_summary;source_doc;must_contain;should_not_contain;notes
47;Налоговый вычет;Получение вычета;Как получить налоговый вычет за обучение?;procedure;Ответ должен описывать порядок предоставления налогового вычета.;Порядок предоставления  налогового вычета.docx;"налоговый вычет; обучение; порядок";"выдуманные сроки; неподтвержденные условия; ссылки без источника";
48;Налоговый вычет;Документы для вычета;Какие документы нужны для налогового вычета?;detailed;"Ответ должен перечислять документы только если они есть в источнике; иначе сказать, что точный список не найден.";Порядок предоставления  налогового вычета.docx;"налоговый вычет; документы";выдуманный список документов;
49;Воинский учет;Порядок учета;Что студенту нужно знать про воинский учет?;definition;Ответ должен объяснять порядок воинского учета в НИУ ВШЭ.;Воинский учет.docx;"воинский учет; порядок";"выдуманные сроки; неподтвержденные условия; ссылки без источника";
50;Воинский учет;Практический вопрос;Куда обращаться по вопросам воинского учета?;procedure;"Ответ должен отвечать по документу о воинском учете; если контактов нет, направить в ответственный отдел/учебный офис без выдумки.";Воинский учет.docx;"воинский учет; обращаться";выдуманные контакты;
51;Библиотека;Правила библиотеки;Какие правила пользования библиотекой?;definition;Ответ должен описывать правила пользования библиотекой НИУ ВШЭ.;Правила пользования библиотекой.docx;"библиотека; правила пользования";"выдуманные сроки; неподтвержденные условия; ссылки без источника";
52;Библиотека;Нарушения;Что будет, если нарушить правила библиотеки?;detailed;Ответ должен описывать последствия только если они есть в правилах библиотеки.;Правила пользования библиотекой.docx;"библиотека; правила; нарушение";выдуманные штрафы;
53;Правила внутреннего распорядка;ПВРО;Какие основные правила внутреннего распорядка для обучающихся?;definition;Ответ должен опираться на правила внутреннего распорядка обучающихся 2024.;ПВРО 2024.docx;"правила внутреннего распорядка; обучающиеся";"выдуманные сроки; неподтвержденные условия; ссылки без источника";
54;Правила внутреннего распорядка;Поведение;Что студенту нельзя делать по правилам внутреннего распорядка?;detailed;Ответ должен перечислить запреты/обязанности только если они есть в документе.;ПВРО 2024.docx;"запрещено; правила; обучающиеся";выдуманные запреты;
55;Рейтинг;Рейтинговая система;Что такое рейтинговая система?;definition;Ответ должен объяснять рейтинговую систему на основе положения.;Положение о рейтинговой системе.docx;"рейтинг; рейтинговая система";"выдуманные сроки; неподтвержденные условия; ссылки без источника";
56;Рейтинг;Сравнение результатов;Как сравниваются результаты обучения студентов?;detailed;Ответ должен объяснять систему сравнения результатов обучения.;Система сравнения результатов обучения .docx;"сравнение результатов; обучение; рейтинг";"выдуманные сроки; неподтвержденные условия; ссылки без источника";
57;Горячая линия;Выразительная кнопка;Что такое горячая линия «Выразительная кнопка»?;definition;Ответ должен объяснять назначение и регламент работы горячей линии «Выразительная кнопка».;Регламент выразительной кнопки.docx;"горячая линия; Выразительная кнопка; регламент";"выдуманные сроки; неподтвержденные условия; ссылки без источника";
58;Горячая линия;Обращение;Когда можно обращаться в «Выразительную кнопку»?;procedure;Ответ должен описывать случаи обращения только на основе регламента.;Регламент выразительной кнопки.docx;"обращение; Выразительная кнопка";выдуманные контакты/сроки;
59;Устав;Общие правила;Что регулирует Устав НИУ ВШЭ?;definition;Ответ должен объяснять назначение Устава НИУ ВШЭ в общих словах на основе документа.;Устав НИУ ВШЭ.docx;"Устав; НИУ ВШЭ; регулирует";"выдуманные сроки; неподтвержденные условия; ссылки без источника";
60;Устав;Права и обязанности;Какие права и обязанности студентов есть в Уставе?;detailed;Ответ должен перечислить права/обязанности только если они есть в документе.;Устав НИУ ВШЭ.docx;"права; обязанности; студенты";выдуманные права/обязанности;
